{
  "$schema": "ops/schemas/artifact-relocation-audit.schema.json",
  "artifact_kind": "artifact_relocation_audit",
  "generated_at": "2026-05-21T16:30:51Z",
  "producer": "ops.scripts.artifact_relocation_audit",
  "source_command": "python -m ops.scripts.artifact_relocation_audit --vault . --out ops/operator/artifact-relocation-audit.json",
  "source_revision": "unknown",
  "source_tree_fingerprint": "142b6c3c4fa38faeb73df7c8f5d06ba988e940838e0e707e39b756ba30bc25b8",
  "input_fingerprints": {
    "policy": "db4a14398a7f56012e4809c9641e5272afd043bf7bd0f600e794266123b0ec24",
    "schema": "2bca24a2fb1f0a7c49b35b6df2aac4e0676e137502b48691d033ad62e3769173",
    "artifact_envelope_schema": "87fcb7b91ffc04e8180c1c3e51e309cde186ecf23f91f7974a541d0b580976de",
    "source_paths": "1ffc3cd808f7848d5e07c33875f5b587f2c166346a1e07e6617ac6b127df422c",
    "candidate_spec": "b1200b347913aa0fd79d57373d7874415448511a26db8629fc55c649d860c9c2",
    "dependency_paths": "63aa3ebc592d8d80bcfa0c8f3ccd1090939853db8d2e67a1b9489e52582f89b9",
    "dependency_roots": "be545ec75d1f4e02ad9ba08e5ac7019a5c4bf7d0baa3aa348395f93db732be97",
    "excluded_scan_paths": "fd1a01cc9a3c77d51ba8bec1c7117e110d4c742ac36077133fbb3b0b3d4b90bd",
    "excluded_scan_prefixes": "e957c42e176e00f268bb61a907a17e555ae0d84924fcabe7c04d0ab207727581"
  },
  "schema_version": 1,
  "artifact_status": "current",
  "retention_policy": "canonical_report",
  "encoding": "utf-8",
  "currentness": {
    "status": "current",
    "checked_at": "2026-05-21T16:30:51Z"
  },
  "vault": ".",
  "policy": {
    "path": "ops/policies/wiki-maintainer-policy.yaml",
    "version": 4
  },
  "status": "pass",
  "recommended_next_action": "none",
  "relocation_rules": [
    {
      "rule_id": "old_path_reference_free",
      "description": "A moved operator-only artifact must have zero references to its old ops/reports path in dependency surfaces.",
      "gate_effect": "blocking"
    },
    {
      "rule_id": "single_declared_location",
      "description": "An audited artifact must not exist in both the old and new locations.",
      "gate_effect": "blocking"
    }
  ],
  "dependency_scan": {
    "roots": [
      "Makefile",
      "README.md",
      "ARCHITECTURE.md",
      "AGENTS.md",
      "pyproject.toml",
      "ops",
      "tests",
      "mk",
      ".github"
    ],
    "excluded_prefixes": [
      "ops/reports/",
      "ops/operator/",
      "tmp/",
      "build/",
      "runs/",
      "raw/",
      "wiki/",
      "system/",
      "external-reports/"
    ],
    "file_count": 654,
    "files": [
      ".github/workflows/ci.yml",
      ".github/workflows/release.yml",
      "AGENTS.md",
      "ARCHITECTURE.md",
      "Makefile",
      "README.md",
      "mk/artifact.mk",
      "mk/core.mk",
      "mk/eval.mk",
      "mk/mechanism.mk",
      "mk/public.mk",
      "mk/registry.mk",
      "mk/release.mk",
      "mk/static.mk",
      "mk/supply_chain.mk",
      "mk/test.mk",
      "ops/README.md",
      "ops/__init__.py",
      "ops/evals/wiki-quality-evals.md",
      "ops/evals/wiki-stage2-evals.md",
      "ops/manifest.json",
      "ops/mypy-allowlist.txt",
      "ops/mypy-strict-preview-allowlist.txt",
      "ops/policies/distribution-profile-matrix.json",
      "ops/policies/execution-lanes.json",
      "ops/policies/learning-claim-auto-unlock.json",
      "ops/policies/learning-claim-confirmed-improvement.json",
      "ops/policies/release-closeout-batch.json",
      "ops/policies/release-closeout-fixed-point.json",
      "ops/policies/release-lane-definitions.json",
      "ops/policies/release-risk-taxonomy.json",
      "ops/policies/release-status-v2-consumers.json",
      "ops/policies/remediation-backlog-status-overrides.json",
      "ops/policies/report-contract-closeout.json",
      "ops/policies/report-contract-deselections.json",
      "ops/policies/source-package-test-deselections.json",
      "ops/policies/wiki-maintainer-policy.yaml",
      "ops/raw-registry.json",
      "ops/ruff-strict-preview-allowlist.txt",
      "ops/runtime-decomposition-plan.md",
      "ops/schemas/accepted-risk-vocabulary.schema.json",
      "ops/schemas/archive-execution-manifest.schema.json",
      "ops/schemas/artifact-envelope.schema.json",
      "ops/schemas/artifact-freshness-report.schema.json",
      "ops/schemas/artifact-relocation-audit.schema.json",
      "ops/schemas/auto-improve-readiness-report.schema.json",
      "ops/schemas/auto-improve-session.schema.json",
      "ops/schemas/behavior-delta.schema.json",
      "ops/schemas/bootstrap-preflight-report.schema.json",
      "ops/schemas/bundle-manifest.schema.json",
      "ops/schemas/changed-files-manifest.schema.json",
      "ops/schemas/clean-fixture-regeneration-guard.schema.json",
      "ops/schemas/codex-goal-contract.schema.json",
      "ops/schemas/codex-goal-prompt.schema.json",
      "ops/schemas/cyclonedx-1.6.schema.json",
      "ops/schemas/defect-escape-closures.schema.json",
      "ops/schemas/distribution-profile-matrix.schema.json",
      "ops/schemas/eval-report.schema.json",
      "ops/schemas/executor-report.schema.json",
      "ops/schemas/external-report-action-matrix.schema.json",
      "ops/schemas/external-report-reference-manifest.schema.json",
      "ops/schemas/function-budget-refactor-proposals.schema.json",
      "ops/schemas/generated-artifact-index.schema.json",
      "ops/schemas/goal-resume-metadata.schema.json",
      "ops/schemas/goal-run-resume-metadata.schema.json",
      "ops/schemas/goal-run-status.schema.json",
      "ops/schemas/goal-runtime-certificate.schema.json",
      "ops/schemas/goal-runtime-clean-transient.schema.json",
      "ops/schemas/goal-runtime-closeout-plan.schema.json",
      "ops/schemas/goal-runtime-fixed-point-check.schema.json",
      "ops/schemas/goal-runtime-quarantine-preflight.schema.json",
      "ops/schemas/goal-runtime-run-admission.schema.json",
      "ops/schemas/goal-worktree-guard.schema.json",
      "ops/schemas/improvement-observations.schema.json",
      "ops/schemas/in-toto-statement.schema.json",
      "ops/schemas/learning-claim-activation-report.schema.json",
      "ops/schemas/learning-claim-evidence-bundle.schema.json",
      "ops/schemas/learning-claim-unlock-review.schema.json",
      "ops/schemas/learning-confirmed-evidence-cohort.schema.json",
      "ops/schemas/learning-confirmed-legacy-reconstruction.schema.json",
      "ops/schemas/learning-delta-scoreboard.schema.json",
      "ops/schemas/learning-readiness-signoff-revalidation.schema.json",
      "ops/schemas/learning-readiness-signoff.schema.json",
      "ops/schemas/learning-readiness-vocabulary.schema.json",
      "ops/schemas/lint-report.schema.json",
      "ops/schemas/make-target-inventory.schema.json",
      "ops/schemas/manual-mutate-defect-registry.schema.json",
      "ops/schemas/mechanism-assessment-report.schema.json",
      "ops/schemas/mechanism-review-candidates.schema.json",
      "ops/schemas/mutation-proposals.schema.json",
      "ops/schemas/openvex-draft.schema.json",
      "ops/schemas/operator-release-summary.schema.json",
      "ops/schemas/outcome-metrics.schema.json",
      "ops/schemas/outcome-provenance-gate-policy.schema.json",
      "ops/schemas/planning-gate-validation-report.schema.json",
      "ops/schemas/planning-validation.schema.json",
      "ops/schemas/promotion-decision-trends.schema.json",
      "ops/schemas/promotion-report.schema.json",
      "ops/schemas/proposal-scope.schema.json",
      "ops/schemas/proposal-snapshot.schema.json",
      "ops/schemas/public-check-summary.schema.json",
      "ops/schemas/raw-intake-absorption-matrix.schema.json",
      "ops/schemas/raw-intake-final-tree-validation-report.schema.json",
      "ops/schemas/raw-intake-promotion-profile-bundle.schema.json",
      "ops/schemas/raw-intake-promotion-report.schema.json",
      "ops/schemas/raw-intake-route-proposal-report.schema.json",
      "ops/schemas/raw-intake-source-quality-report.schema.json",
      "ops/schemas/raw-markdown-normalization-report.schema.json",
      "ops/schemas/raw-registry-cross-environment-evidence-bundle.schema.json",
      "ops/schemas/raw-registry-cross-environment-matrix.schema.json",
      "ops/schemas/raw-registry-export.schema.json",
      "ops/schemas/raw-registry-preflight-report.schema.json",
      "ops/schemas/raw-registry-preflight-reproducibility.schema.json",
      "ops/schemas/release-authority-vocabulary.schema.json",
      "ops/schemas/release-clean-blocker-ledger.schema.json",
      "ops/schemas/release-clean-lane-evidence-review.schema.json",
      "ops/schemas/release-closeout-batch-manifest.schema.json",
      "ops/schemas/release-closeout-finality-attestation.schema.json",
      "ops/schemas/release-closeout-fixed-point-cost-trend.schema.json",
      "ops/schemas/release-closeout-fixed-point.schema.json",
      "ops/schemas/release-closeout-post-check-finalizer.schema.json",
      "ops/schemas/release-closeout-sealed-rehearsal-check.schema.json",
      "ops/schemas/release-closeout-summary.schema.json",
      "ops/schemas/release-evidence-closeout-self-check.schema.json",
      "ops/schemas/release-evidence-cohort.schema.json",
      "ops/schemas/release-evidence-dashboard.schema.json",
      "ops/schemas/release-lane-summary.schema.json",
      "ops/schemas/release-live-artifact-attestation.schema.json",
      "ops/schemas/release-post-seal-attestation.schema.json",
      "ops/schemas/release-risk-taxonomy-matrix.schema.json",
      "ops/schemas/release-risk-taxonomy.schema.json",
      "ops/schemas/release-smoke-report.schema.json",
      "ops/schemas/release-workflow-order-guard.schema.json",
      "ops/schemas/remediation-backlog-status-overrides.schema.json",
      "ops/schemas/remediation-backlog.schema.json",
      "ops/schemas/review-archive-report.schema.json",
      "ops/schemas/rework-closures.schema.json",
      "ops/schemas/rollback-rehearsal-report.schema.json",